Symbol,Name,Last Sale,Net Change,% Change,Market Cap,Country,IPO Year,Volume,Sector,Industry
PRTS,CarParts.com Inc.,$15.43 ,1.15,8.05%,742068031,United States,2007,1613758,Consumer Services,Other Specialty Stores
PRTY,Party City Holdco Inc.,$6.04 ,0.24,4.14%,668828347,United States,2015,2060729,Consumer Services,Other Specialty Stores
PRU,Prudential Financial Inc.,$92.71 ,1.61,1.77%,36659022459,United States,2001,1895064,Finance,Life Insurance
PRVB,Provention Bio Inc.,$11.04 ,0.54,5.15%,699340234,United States,2018,639794,Health Care,Major Pharmaceuticals
PS,Pluralsight Inc. Class A,$22.42 ,0.08,0.36%,3330148265,United States,2018,2704303,Technology,Computer Software: Programming Data Processing
PSA,Public Storage,$251.94 ,5.18,2.10%,44036525584,United States,,844326,Consumer Services,Real Estate Investment Trusts
PSAC,Property Solutions Acquisition Corp.,$12.40 ,0.34,2.82%,366004736,United States,2020,453901,Capital Goods,Auto Manufacturing
PSACU,Property Solutions Acquisition Corp. Unit,$15.09 ,-0.2438,-1.59%,0,United States,2020,714,Capital Goods,Auto Manufacturing
PSACW,Property Solutions Acquisition Corp. Warrant,$2.60 ,0.04,1.56%,0,United States,2020,202813,Capital Goods,Auto Manufacturing
PSAGU,Property Solutions Acquisition Corporation II Units,$9.95 ,0.12,1.22%,0,United States,2021,36698,Finance,Business Services
PSB,PS Business Parks Inc.,$159.20 ,4.62,2.99%,4376198493,United States,,84544,Consumer Services,Real Estate Investment Trusts
PSEC,Prospect Capital Corporation,$7.79 ,0.12,1.57%,3014695568,United States,2004,1788478,,
PSF,Cohen & Steers Select Preferred and Income Fund Inc.,$27.84 ,0.14,0.51%,334541810,,2010,18166,,
PSFE,Paysafe Limited Common Shares,$14.60 ,1.1,8.15%,0,,2021,9497202,,
PSHG,Performance Shipping Inc. Common Shares,$5.80 ,0.23,4.13%,29479811,Greece,,28254,Transportation,Marine Transportation
PSMT,PriceSmart Inc.,$97.77 ,1.02,1.05%,3005286915,United States,,64402,Consumer Services,Department/Specialty Retail Stores
PSN,Parsons Corporation,$40.47 ,0.03,0.07%,4142535991,,2019,354301,Technology,EDP Services
PSNL,Personalis Inc.,$24.13 ,-0.48,-1.95%,1054344014,United States,2019,1283752,Health Care,Medical Specialities
PSO,Pearson Plc,$10.74 ,0.05,0.47%,8095060963,United Kingdom,,148730,Consumer Services,Books
PSTG,Pure Storage Inc. Class A,$21.97 ,0.43,2.00%,6158977394,,2015,3499608,Technology,Electronic Components
PSTH,Pershing Square Tontine Holdings Ltd. Class A,$24.47 ,0.46,1.92%,4894002447,,2020,1351778,Finance,Business Services
PSTI,Pluristem Therapeutics Inc.,$4.81 ,0.04,0.84%,151655774,Israel,,399835,Health Care,Biotechnology: Biological Products (No Diagnostic Substances)
PSTL,Postal Realty Trust Inc. Class A,$17.30 ,0.12,0.70%,228392593,,2019,67263,Consumer Services,Real Estate Investment Trusts
PSTV,PLUS THERAPEUTICS Inc. ,$2.46 ,0.06,2.50%,22550579,United States,,345571,Health Care,Medical/Dental Instruments
PSTX,Poseida Therapeutics Inc.,$9.48 ,-0.07,-0.73%,588785433,United States,2020,393320,Health Care,Biotechnology: Biological Products (No Diagnostic Substances)
PSX,Phillips 66,$83.16 ,1.62,1.99%,36334770983,United States,,2732494,Energy,Integrated oil Companies
PSXP,Phillips 66 Partners LP Common Units representing limited partner interest in the Partnership,$33.18 ,1.51,4.77%,7576326044,United States,2013,1005649,Energy,Natural Gas Distribution
PT,Pintec Technology Holdings Limited American Depositary Shares,$1.14 ,0.04,3.64%,49177612,China,2018,188654,Technology,Computer Software: Programming Data Processing
PTA,Cohen & Steers Tax-Advantaged Preferred Securities and Income Fund Common Shares of Beneficial Interest,$24.80 ,-0.05,-0.20%,1370781734,,2020,101829,,
PTC,PTC Inc.,$143.87 ,6.22,4.52%,16805514838,United States,,837590,Technology,Computer Software: Prepackaged Software
PTCT,PTC Therapeutics Inc.,$49.19 ,1.84,3.89%,3459154921,United States,2013,537748,Health Care,Major Pharmaceuticals
PTE,PolarityTE Inc.,$1.11 ,0,0.00%,89154510,United States,,1960315,Health Care,Biotechnology: Biological Products (No Diagnostic Substances)
PTEN,Patterson-UTI Energy Inc.,$7.35 ,0.22,3.09%,1379862694,United States,1993,1681559,Energy,Oil & Gas Production
PTGX,Protagonist Therapeutics Inc.,$26.71 ,0.81,3.13%,1170119907,United States,2016,209600,Health Care,Major Pharmaceuticals
PTIC,PropTech Investment Corporation II Class A,$9.79 ,0,0.00%,281462500,United States,2021,3070,Finance,Business Services
PTICU,PropTech Investment Corporation II Unit,$10.02 ,-0.005,-0.05%,0,United States,2020,844,Finance,Business Services
PTICW,PropTech Investment Corporation II Warrant,$0.89 ,0.05,5.95%,0,United States,2021,6659,Finance,Business Services
PTK,PTK Acquisition Corp.,$9.85 ,0.005,0.05%,141593750,United States,2020,1491,Finance,Business Services
PTMN,Portman Ridge Finance Corporation,$2.17 ,0.01,0.46%,163173456,United States,,134915,,
PTN,Palatin Technologies Inc.,$0.72 ,0.0254,3.68%,164474530,United States,,1808105,Health Care,Major Pharmaceuticals
PTNR,Partner Communications Company Ltd. American Depositary Shares,$4.81 ,0.04,0.84%,883864080,Israel,,1584,Public Utilities,Telecommunications Equipment
PTOCU,Pine Technology Acquisition Corp. Unit,$9.95 ,0.025,0.25%,0,United States,2021,14246,Finance,Business Services
PTON,Peloton Interactive Inc. Class A,$112.09 ,-0.35,-0.31%,33010691630,United States,2019,6981539,Energy,Consumer Electronics/Appliances
PTPI,Petros Pharmaceuticals Inc.,$3.61 ,-0.12,-3.22%,35263646,United States,,21064,Health Care,Major Pharmaceuticals
PTR,PetroChina Company Limited,$36.52 ,0.37,1.02%,66839261093,China,,192457,Energy,Oil & Gas Production
PTRS,Partners Bancorp,$7.59 ,0.28,3.83%,135179517,United States,,16415,Finance,Major Banks
PTSI,P.A.M. Transportation Services Inc.,$63.30 ,1.6,2.59%,362388639,United States,1986,9008,Transportation,Trucking Freight/Courier Services
PTVCA,Protective Insurance Corporation Class A,$22.92 ,0,0.00%,324458981,United States,,1,Finance,Property-Casualty Insurers
PTVCB,Protective Insurance Corporation Class B,$23.02 ,0.15,0.66%,325874596,United States,,20233,Finance,Property-Casualty Insurers
PTVE,Pactiv Evergreen Inc.,$13.88 ,0.14,1.02%,2458949015,United States,2020,236504,Consumer Durables,Containers/Packaging
PTY,Pimco Corporate & Income Opportunity Fund,$18.29 ,0.02,0.11%,2023179644,United States,2002,481311,,
PUBM,PubMatic Inc. Class A,$58.00 ,8.68,17.60%,2773937232,United States,2020,1118952,Technology,Computer Software: Programming Data Processing
PUCK,Goal Acquisitions Corp.,$9.64 ,0,0.00%,0,United States,2021,132241,Finance,Business Services
PUCKU,Goal Acquisitions Corp. Unit,$10.06 ,0.05,0.50%,0,United States,2021,144383,Finance,Business Services
PUCKW,Goal Acquisitions Corp. Warrant,$0.45 ,0.005,1.14%,0,United States,2021,593500,Finance,Business Services
PUK,Prudential Public Limited Company,$43.22 ,0.53,1.24%,56391680263,United Kingdom,,122316,Finance,Life Insurance
PULM,Pulmatrix Inc.,$1.42 ,0.09,6.77%,79873668,United States,2014,844163,Health Care,Major Pharmaceuticals
PUMP,ProPetro Holding Corp.,$11.13 ,0.47,4.41%,1135903481,United States,2017,745834,Energy,Oilfield Services/Equipment
PUYI,Puyi Inc. American Depository Shares,$4.51 ,-0.24,-5.05%,272019189,China,2019,103854,Finance,Investment Managers
PV,Primavera Capital Acquisition Corporation Class A Ordinary Shares,$9.83 ,0.03,0.31%,528362500,,2021,16330,Finance,Business Services
PVAC,Penn Virginia Corporation,$14.23 ,0.83,6.19%,217243690,United States,,346554,Energy,Oil & Gas Production
PVBC,Provident Bancorp Inc. (MD),$14.73 ,0.33,2.29%,280085942,United States,2015,69972,Finance,Savings Institutions
PVG,Pretium Resources Inc. Ordinary Shares (Canada),$10.97 ,0.6,5.79%,2059980431,Canada,,1433102,Basic Industries,Precious Metals
PVH,PVH Corp.,$100.98 ,-4.72,-4.47%,7179703245,United States,,1398671,Consumer Non-Durables,Apparel
PVL,Permianville Royalty Trust Trust Units ,$1.52 ,0.025,1.68%,49995000,United States,2011,259480,Energy,Oil & Gas Production
PW,Power REIT (MD),$46.26 ,1.02,2.26%,152622519,United States,,27237,Consumer Services,Real Estate Investment Trusts
PWFL,PowerFleet Inc.,$8.59 ,0.37,4.50%,309040789,United States,,112809,Capital Goods,Telecommunications Equipment
PWOD,Penns Woods Bancorp Inc.,$24.55 ,0.46,1.91%,173242280,United States,,11541,Finance,Major Banks
PWR,Quanta Services Inc.,$89.17 ,1.19,1.35%,12338007674,United States,,1358829,Capital Goods,Engineering & Construction
PXD,Pioneer Natural Resources Company,$164.60 ,5.78,3.64%,35649114088,United States,,2201288,Energy,Oil & Gas Production
PXLW,Pixelworks Inc. ,$3.43 ,0.12,3.63%,179088604,United States,2000,416923,Technology,Semiconductors
PXS,Pyxis Tankers Inc.,$1.12 ,0.09,8.74%,24147071,Greece,,4542818,Transportation,Marine Transportation
PXSAW,Pyxis Tankers Inc. Warrant,$0.64 ,-0.0056,-0.87%,0,Greece,,144115,Transportation,Marine Transportation
PYN,PIMCO New York Municipal Income Fund III Common Shares of Beneficial Interest,$9.77 ,-0.03,-0.31%,55962560,United States,2002,7242,,
PYPD,PolyPid Ltd. Ordinary Shares,$9.66 ,0.5,5.46%,181078072,Israel,2020,25053,Health Care,Medical/Dental Instruments
PYPL,PayPal Holdings Inc.,$247.54 ,4.7,1.94%,2.89913E+11,United States,,6985972,Miscellaneous,Business Services
PYR,PyroGenesis Canada Inc. Common Shares,$7.04 ,0.27,3.99%,1124051907,Canada,,227709,Health Care,Major Pharmaceuticals
PYS,Merrill Lynch Depositor Inc PPlus Tr Ser RRD-1 Tr Ctf Cl A,$22.65 ,0.1457,0.65%,0,United States,,4823,Finance,Finance: Consumer Services
PYT,PPlus Tr GSC-2 Tr Ctf Fltg Rate,$24.06 ,0.305,1.28%,0,United States,,500,Finance,Finance: Consumer Services
PZC,PIMCO California Municipal Income Fund III Common Shares of Beneficial Interest,$10.64 ,0.09,0.85%,238133840,United States,2002,24368,,
PZG,Paramount Gold Nevada Corp.,$1.04 ,0.0399,3.99%,37671985,United States,2015,126164,Basic Industries,Precious Metals
PZN,Pzena Investment Management Inc Class A,$11.21 ,0.68,6.46%,813733463,United States,2007,83388,Finance,Investment Managers
PZZA,Papa John's International Inc.,$88.48 ,-0.16,-0.18%,2914591189,United States,1993,582943,Consumer Services,Restaurants
QADA,QAD Inc. Class A,$70.00 ,3.42,5.14%,1448935390,United States,,56371,Technology,Computer Software: Prepackaged Software
QADB,QAD Inc. Class B,$45.80 ,2.55,5.90%,948017727,United States,,4165,Technology,Computer Software: Prepackaged Software
QCOM,QUALCOMM Incorporated,$137.79 ,5.2,3.92%,1.56529E+11,United States,1991,14062129,Technology,Radio And Television Broadcasting And Communications Equipment
QCRH,QCR Holdings Inc.,$47.98 ,0.76,1.61%,759377205,United States,,49607,Finance,Major Banks
QD,Qudian Inc. American Depositary Shares each representing one Class A Ordinary Share,$2.29 ,0.01,0.44%,581040209,China,2017,4111125,Finance,Finance: Consumer Services
QDEL,Quidel Corporation,$130.31 ,2.38,1.86%,5514603876,United States,,1005848,Health Care,Biotechnology: In Vitro & In Vivo Diagnostic Substances
QELL,Qell Acquisition Corp. Class A Ordinary Shares,$10.19 ,0.01,0.10%,483388125,United States,2020,1317418,Finance,Business Services
QELLU,Qell Acquisition Corp. Unit,$10.89 ,0.14,1.30%,0,United States,2020,44086,Finance,Business Services
QELLW,Qell Acquisition Corp. Warrant,$1.80 ,0.08,4.65%,0,United States,2020,240159,Finance,Business Services
QFIN,360 DigiTech Inc. American Depositary Shares,$25.62 ,-0.39,-1.50%,3897097860,China,2018,1677954,Finance,Finance: Consumer Services
QFTA,Quantum FinTech Acquisition Corporation,$9.68 ,0.02,0.21%,0,,2021,331309,Finance,Business Services
QGEN,Qiagen N.V. Common Shares ,$49.29 ,0.6,1.23%,11231776180,Netherlands,,775162,Health Care,Biotechnology: Biological Products (No Diagnostic Substances)
QH,Quhuo Limited American Depository Shares,$6.12 ,-0.07,-1.13%,317667229,China,2020,13726,Miscellaneous,Business Services
QIWI,QIWI plc American Depositary Shares,$10.63 ,-0.02,-0.19%,666638924,Cyprus,2013,262920,Miscellaneous,Business Services
QK,Q&K International Group Limited American Depositary Shares,$2.60 ,0,0.00%,140949461,China,2019,8350,Finance,Real Estate
QLGN,Qualigen Therapeutics Inc.,$2.75 ,0.05,1.85%,73444385,United States,2015,477356,Health Care,Major Pharmaceuticals
QLI,Qilian International Holding Group Ltd. Ordinary Shares,$4.68 ,0.025,0.54%,167310000,China,2021,32005,Health Care,Major Pharmaceuticals
QLYS,Qualys Inc.,$103.88 ,-0.9,-0.86%,4072899512,United States,2012,385821,Technology,Computer Software: Prepackaged Software
QMCO,Quantum Corporation,$8.65 ,0.32,3.84%,490136741,United States,,333611,Technology,Electronic Components
QNST,QuinStreet Inc.,$20.70 ,0.4,1.97%,1103237571,United States,2010,437688,Miscellaneous,Business Services
QQQX,Nuveen NASDAQ 100 Dynamic Overwrite Fund Shares of Beneficial Interest,$27.47 ,0.29,1.07%,1140222068,United States,,146168,,
QRHC,Quest Resource Holding Corporation,$3.98 ,0.08,2.05%,73285408,United States,,77776,Technology,Diversified Commercial Services
QRTEA,Qurate Retail Inc. Series A ,$11.82 ,0.06,0.51%,4851078528,United States,,3043368,Consumer Services,Catalog/Specialty Distribution
QRTEB,Qurate Retail Inc. Series B ,$13.30 ,-0.3,-2.21%,5458489376,United States,,88924,Consumer Services,Catalog/Specialty Distribution
QRTEP,Qurate Retail Inc. 8.0% Fixed Rate Cumulative Redeemable Preferred Stock,$101.89 ,0.24,0.24%,0,United States,,46479,Consumer Services,Catalog/Specialty Distribution
QRVO,Qorvo Inc.,$192.90 ,10.2,5.58%,21848376180,United States,,1989407,Technology,Semiconductors
QS,QuantumScape Corporation Class A,$49.30 ,4.55,10.17%,18665966838,United States,2020,24912058,Miscellaneous,Industrial Machinery/Components
QSR,Restaurant Brands International Inc. Common Shares,$65.55 ,0.55,0.85%,19869074127,Canada,2014,1109508,Consumer Services,Restaurants
QTNT,Quotient Limited Ordinary Shares,$3.81 ,0.13,3.53%,385317694,Switzerland,2014,353473,Health Care,Biotechnology: In Vitro & In Vivo Diagnostic Substances
QTRX,Quanterix Corporation,$61.45 ,2.98,5.10%,2228644573,United States,2017,384173,Capital Goods,Biotechnology: Laboratory Analytical Instruments
QTS,QTS Realty Trust Inc. Class A,$64.20 ,2.16,3.48%,4172133493,United States,2013,1064859,Consumer Services,Real Estate Investment Trusts
QTT,Qutoutiao Inc. American Depositary Shares,$2.56 ,0.27,11.79%,735978885,China,2018,4458324,Technology,Computer Software: Programming Data Processing
QTWO,Q2 Holdings Inc.,$103.10 ,2.9,2.89%,5732309687,,2014,515077,Technology,Computer Software: Prepackaged Software
QUAD,Quad Graphics Inc Class A,$3.80 ,0.27,7.65%,203894738,United States,,267902,Miscellaneous,Publishing
QUIK,QuickLogic Corporation,$7.63 ,0.71,10.26%,85992313,United States,1999,146007,Technology,Semiconductors
QUMU,Qumu Corporation,$6.81 ,0.05,0.74%,119719316,United States,,42127,Technology,Computer Software: Prepackaged Software
QUOT,Quotient Technology Inc.,$15.88 ,-0.46,-2.82%,1470150201,,2014,1317834,Consumer Services,Advertising
QURE,uniQure N.V. Ordinary Shares,$34.11 ,0.42,1.25%,1534744897,Netherlands,2014,608898,Health Care,Major Pharmaceuticals
QVCC,QVC Inc. 6.250% Senior Secured Notes due 2068,$25.48 ,0.43,1.72%,0,United States,2019,47932,Consumer Services,Catalog/Specialty Distribution
QVCD,QVC Inc. 6.375% Senior Secured Notes due 2067,$25.50 ,0.09,0.35%,0,United States,2018,21693,Consumer Services,Catalog/Specialty Distribution
R,Ryder System Inc.,$76.91 ,1.26,1.67%,4139845107,United States,,249760,Consumer Services,Rental/Leasing Companies
RA,Brookfield Real Assets Income Fund Inc.,$20.74 ,0.04,0.19%,910285092,,2016,382233,,
RAAC,Revolution Acceleration Acquisition Corp Class A,$10.16 ,0.02,0.20%,389466663,United States,2021,228380,Finance,Business Services
RAACU,Revolution Acceleration Acquisition Corp Unit,$10.83 ,0.08,0.74%,0,United States,2020,8773,Finance,Business Services
RAACW,Revolution Acceleration Acquisition Corp Warrant,$2.03 ,0.05,2.53%,0,United States,2021,58340,Finance,Business Services
RAAS,Cloopen Group Holding Limited American Depositary Shares each representing two Class A Ordinary Shares,$12.90 ,-0.83,-6.05%,2062004383,,2021,1127800,Technology,Computer Software: Prepackaged Software
RACA,Therapeutics Acquisition Corp. Class A,$10.51 ,0,0.00%,187808445,United States,2020,795487,Finance,Business Services
RACB,Research Alliance Corp. II Class A,$10.48 ,0.23,2.24%,201074520,United States,2021,7707,Finance,Business Services
RACE,Ferrari N.V. Common Shares,$208.04 ,-1.24,-0.59%,51660682116,,2015,487014,Capital Goods,Auto Manufacturing
RAD,Rite Aid Corporation,$20.94 ,0.48,2.35%,1156398161,United States,,1979825,Health Care,Medical/Nursing Services
RADA,RADA Electronic Industries Ltd. Ordinary Shares,$12.54 ,0.53,4.41%,545302715,Israel,,603854,Technology,Electronic Components
RADI,Radius Global Infrastructure Inc. Class A,$14.55 ,-0.15,-1.02%,886086576,United States,,567277,Consumer Services,Real Estate
RAIL,FreightCar America Inc.,$6.65 ,0.055,0.83%,103662009,United States,2005,9014049,Capital Goods,Railroads
RAMP,LiveRamp Holdings Inc.,$53.06 ,1.18,2.27%,3550743948,United States,2018,625321,Technology,EDP Services
RAND,Rand Capital Corporation,$18.51 ,0.495,2.75%,47783037,United States,,6167,Finance,Finance: Consumer Services
RAPT,RAPT Therapeutics Inc.,$23.00 ,0.8,3.60%,571923704,United States,2019,90491,Health Care,Major Pharmaceuticals
RARE,Ultragenyx Pharmaceutical Inc.,$113.20 ,-0.66,-0.58%,7578654421,United States,2014,410162,Health Care,Major Pharmaceuticals
RAVE,Rave Restaurant Group Inc.,$1.41 ,-0.01,-0.70%,25386915,United States,,296685,Consumer Non-Durables,Food Distributors
RAVN,Raven Industries Inc.,$38.48 ,0.15,0.39%,1380258322,United States,,284241,Capital Goods,Specialty Chemicals
RBA,Ritchie Bros. Auctioneers Incorporated,$60.48 ,1.93,3.30%,6650869357,Canada,,504605,Miscellaneous,Business Services
RBAC,RedBall Acquisition Corp. Class A Ordinary Shares,$9.96 ,0.01,0.10%,715875000,United States,2020,215485,Finance,Business Services
RBB,RBB Bancorp,$20.21 ,-0.06,-0.30%,394448392,United States,2017,34357,Finance,Major Banks
RBBN,Ribbon Communications Inc.,$8.44 ,0.23,2.80%,1228500565,United States,,662144,Technology,EDP Services
RBC,Regal Beloit Corporation,$145.65 ,2.97,2.08%,5916809425,United States,,214444,Consumer Durables,Metal Fabrications
RBCAA,Republic Bancorp Inc. Class A,$45.37 ,1.08,2.44%,946609571,United States,1998,30115,Finance,Major Banks
RBCN,Rubicon Technology Inc.,$10.30 ,-0.02,-0.19%,24949227,United States,2007,1654,Technology,Semiconductors
RBKB,Rhinebeck Bancorp Inc.,$10.56 ,0.2122,2.05%,149185773,United States,2019,4471,Finance,Banks
RBLX,Roblox Corporation Class A,$67.34 ,2.51,3.87%,37073393768,,2021,4056197,Technology,Computer Software: Prepackaged Software
RBNC,Reliant Bancorp Inc.,$28.97 ,0.25,0.87%,474758651,United States,,50344,Finance,Major Banks
RC,Ready Capital Corproation,$13.55 ,0.13,0.97%,964720570,United States,2013,462199,Consumer Services,Real Estate Investment Trusts
RCA,Ready Capital Corporation 7.00% Convertible Senior Notes due 2023,$26.53 ,-0.03,-0.11%,0,United States,2017,4176,Consumer Services,Real Estate Investment Trusts
RCB,Ready Capital Corporation 6.20% Senior Notes due 2026,$26.18 ,-0.05,-0.19%,0,United States,2019,2130,Consumer Services,Real Estate Investment Trusts
RCEL,Avita Therapeutics Inc.,$20.87 ,1.05,5.30%,518470968,Australia,,126373,Health Care,Medical/Dental Instruments
RCG,RENN Fund Inc,$2.63 ,0.0037,0.14%,15653644,United States,,23246,,
RCHG,Recharge Acquisition Corp. Class A,$9.80 ,0.01,0.10%,245490000,United States,2020,9352,Finance,Business Services
RCHGU,Recharge Acquisition Corp. Unit,$10.21 ,0.085,0.84%,0,United States,2020,804,Finance,Business Services
RCHGW,Recharge Acquisition Corp. Warrant,$0.75 ,-0.0222,-2.88%,0,United States,2020,20429,Finance,Business Services
RCI,Rogers Communication Inc.,$46.94 ,0.84,1.82%,23404727771,Canada,,467925,Consumer Services,Television Services
RCII,Rent-A-Center Inc.,$58.98 ,1.32,2.29%,3209321029,United States,1995,407088,Technology,Diversified Commercial Services
RCKT,Rocket Pharmaceuticals Inc.,$45.22 ,0.85,1.92%,2793613776,United States,2015,770987,Health Care,Major Pharmaceuticals
RCKY,Rocky Brands Inc.,$56.97 ,2.91,5.38%,413084400,United States,1993,169270,Consumer Non-Durables,Shoe Manufacturing
RCL,D/B/A Royal Caribbean Cruises Ltd.,$86.67 ,1.06,1.24%,22062638757,United States,1993,2394976,Consumer Services,Marine Transportation
RCLFU,Rosecliff Acquisition Corp I Unit,$9.93 ,0.01,0.10%,0,United States,2021,51188,Finance,Business Services
RCM,R1 RCM Inc.,$24.98 ,0.3,1.22%,6521434101,United States,,529017,Consumer Services,Other Consumer Services
RCMT,RCM Technologies Inc.,$3.75 ,0.2,5.63%,44827238,United States,,424840,Technology,Professional Services
RCON,Recon Technology Ltd. Ordinary Shares,$5.16 ,-1.32,-20.37%,37166613,China,2009,1753385,Energy,Oilfield Services/Equipment
RCS,PIMCO Strategic Income Fund Inc.,$7.32 ,-0.01,-0.14%,323441520,United States,1994,91241,,
RCUS,Arcus Biosciences Inc.,$28.83 ,0.75,2.67%,2043361480,,2018,449242,Health Care,Major Pharmaceuticals
RDCM,Radcom Ltd. Ordinary Shares,$9.83 ,-0.05,-0.51%,137066138,Israel,1997,3296,Technology,Computer peripheral equipment
RDFN,Redfin Corporation,$68.86 ,2.27,3.41%,7106795045,United States,2017,1593087,Finance,Real Estate
RDHL,Redhill Biopharma Ltd. American Depositary Shares,$7.51 ,0.19,2.60%,3484257366,Israel,,110420,Health Care,Major Pharmaceuticals
RDI,Reading International Inc Class A,$6.25 ,0.7,12.61%,135932481,United States,,170601,Consumer Services,Movies/Entertainment
RDIB,Reading International Inc Class B,$20.89 ,0.48,2.35%,454340725,United States,,143,Consumer Services,Movies/Entertainment
RDN,Radian Group Inc.,$23.26 ,0.01,0.04%,4458682977,United States,,696815,Finance,Property-Casualty Insurers
RDNT,RadNet Inc.,$22.02 ,0.27,1.24%,1151031466,United States,,127020,Health Care,Medical Specialities
RDUS,Radius Health Inc.,$20.70 ,-0.16,-0.77%,970714680,United States,2014,387402,Health Care,Major Pharmaceuticals
RDVT,Red Violet Inc. ,$19.06 ,0.64,3.47%,232533468,United States,,36771,Technology,Computer Software: Prepackaged Software
RDWR,Radware Ltd. Ordinary Shares,$26.45 ,0.37,1.42%,1220936708,Israel,1999,205430,Miscellaneous,Business Services
RDY,Dr. Reddy's Laboratories Ltd,$62.72 ,1.33,2.17%,10407752221,India,,167327,Health Care,Major Pharmaceuticals
RE,Everest Re Group Ltd.,$251.11 ,3.3,1.33%,10042306245,Bermuda,,235406,Finance,Property-Casualty Insurers
REAL,The RealReal Inc.,$22.70 ,0.07,0.31%,2039259494,United States,2019,2238678,Consumer Services,Other Specialty Stores
REDU,RISE Education Cayman Ltd American Depositary Shares,$3.96 ,-0.09,-2.22%,223257518,China,2017,73975,Consumer Services,Other Consumer Services
REED,Reeds Inc.,$1.18 ,0.01,0.86%,98531883,United States,,1070173,Consumer Non-Durables,Beverages (Production/Distribution)
REFR,Research Frontiers Incorporated,$3.03 ,0.19,6.69%,95900700,United States,,73323,Miscellaneous,Multi-Sector Companies
REG,Regency Centers Corporation,$57.62 ,0.91,1.61%,9785544387,United States,1993,959139,Consumer Services,Real Estate Investment Trusts
REGI,Renewable Energy Group Inc.,$68.48 ,2.44,3.70%,3087409775,United States,2012,1053218,Basic Industries,Major Chemicals
REGN,Regeneron Pharmaceuticals Inc.,$474.93 ,1.79,0.38%,50880152792,United States,1991,761741,Health Care,Major Pharmaceuticals
REI,Ring Energy Inc.,$2.45 ,0.14,6.06%,242994888,United States,,3476527,Energy,Oil & Gas Production
REKR,Rekor Systems Inc.,$20.35 ,0.36,1.80%,830365857,United States,,517986,Capital Goods,Telecommunications Equipment
RELI,Reliance Global Group Inc.,$4.38 ,0.02,0.46%,18230064,United States,,39348,Finance,Specialty Insurers
RELIW,Reliance Global Group Inc. Series A Warrants,$0.90 ,0.0001,0.01%,0,United States,,1057,Finance,Specialty Insurers
RELL,Richardson Electronics Ltd.,$6.75 ,0.38,5.97%,89151665,United States,1983,10853,Technology,Electronic Components
RELX,RELX PLC PLC American Depositary Shares (Each representing One Ordinary Share),$25.60 ,0.44,1.75%,49471848448,United Kingdom,2015,431930,Miscellaneous,Business Services
RENN,Renren Inc. American Depositary Shares each representing fifteen Class A ordinary shares,$8.93 ,-0.12,-1.33%,210567989,China,2011,41311,Consumer Durables,Automotive Aftermarket
REPH,Recro Pharma Inc.,$2.99 ,0.2,7.17%,92729824,United States,2014,277987,Health Care,Major Pharmaceuticals
REPL,Replimune Group Inc.,$31.58 ,1.07,3.51%,1468263688,United States,2018,393788,Health Care,Biotechnology: Biological Products (No Diagnostic Substances)
REPX,Riley Exploration Permian Inc.,$28.99 ,2.99,11.50%,516325525,United States,,20084,Energy,Oil & Gas Production
RES,RPC Inc.,$5.65 ,0.25,4.63%,1219331947,United States,,951039,Energy,Oilfield Services/Equipment
RESN,Resonant Inc.,$4.35 ,0.11,2.59%,261519990,United States,2014,733421,Technology,Semiconductors
RETA,Reata Pharmaceuticals Inc. Class A,$100.62 ,0.92,0.92%,3642537074,United States,2016,298673,Health Care,Major Pharmaceuticals
RETO,ReTo Eco-Solutions Inc. Common Shares,$1.49 ,0.04,2.76%,35961150,China,2017,107309,Capital Goods,Industrial Machinery/Components
REV,Revlon Inc. New,$12.23 ,-0.1,-0.81%,652327629,United States,1996,166484,Consumer Non-Durables,Package Goods/Cosmetics
REVG,REV Group Inc.,$19.23 ,0.07,0.37%,1240715389,United States,2017,215803,Capital Goods,Auto Manufacturing
REVHU,Revolution Healthcare Acquisition Corp. SAIL Units,$10.19 ,0.136,1.35%,0,United States,2021,48060,Finance,Business Services
REX,REX American Resources Corporation,$89.14 ,4.97,5.91%,534126880,United States,,11411,Basic Industries,Major Chemicals
REXR,Rexford Industrial Realty Inc.,$51.83 ,1.43,2.84%,6812012494,United States,2013,546069,Consumer Services,Real Estate Investment Trusts
REYN,Reynolds Consumer Products Inc.,$30.00 ,0.22,0.74%,6291015000,United States,2020,313184,Consumer Durables,Containers/Packaging
REZI,Resideo Technologies Inc. ,$29.60 ,1.35,4.78%,4236928460,,2018,766653,Capital Goods,Wholesale Distributors
RF,Regions Financial Corporation,$21.06 ,0.4,1.94%,20231795114,United States,,8296076,Finance,Major Banks
