Symbol,Name,Last Sale,Net Change,% Change,Market Cap,Country,IPO Year,Volume,Sector,Industry
ITRM,Iterum Therapeutics plc Ordinary Share,$1.46 ,0.05,3.55%,257657826,Ireland,2018,4446059,Health Care,Major Pharmaceuticals
ITRN,Ituran Location and Control Ltd. Ordinary Shares,$21.96 ,0.73,3.44%,515520465,Israel,2005,94475,Technology,Electronic Components
ITT,ITT Inc. ,$90.83 ,-0.08,-0.09%,7856795000,United States,2011,368778,Capital Goods,Fluid Controls
ITUB,Itau Unibanco Banco Holding SA American Depositary Shares (Each repstg 500 Preferred shares),$4.77 ,-0.19,-3.83%,46566919394,Brazil,,38724909,Finance,Major Banks
ITW,Illinois Tool Works Inc.,$221.38 ,-0.14,-0.06%,70062401508,United States,,953029,Technology,Industrial Machinery/Components
IVA,Inventiva S.A. American Depository Shares,$14.45 ,-0.25,-1.70%,558207271,France,2020,15153,Health Care,Major Pharmaceuticals
IVAC,Intevac Inc.,$8.14 ,0.99,13.85%,196089515,United States,1995,2357866,Technology,Industrial Machinery/Components
IVAN,Ivanhoe Capital Acquisition Corp. Class A Ordinary Shares,$9.98 ,0.07,0.71%,344310000,,2021,39181,Finance,Business Services
IVC,Invacare Corporation,$8.32 ,0.3,3.74%,286409086,United States,,171456,Health Care,Industrial Specialties
IVH,Ivy High Income Opportunities Fund Common Shares of Beneficial Interest,$13.60 ,-0.04,-0.29%,225355196,,2013,127701,,
IVR,INVESCO MORTGAGE CAPITAL INC,$4.09 ,0.08,2.00%,944167134,United States,2009,5693950,Consumer Services,Real Estate Investment Trusts
IVZ,Invesco Ltd,$25.75 ,0.53,2.10%,11877961416,United States,,5253338,Finance,Investment Managers
IX,Orix Corp Ads,$84.24 ,-0.55,-0.65%,20546011662,Japan,,18741,Finance,Diversified Financial Services
IZEA,IZEA Worldwide Inc.,$3.85 ,0.08,2.12%,209874730,United States,,1809340,Consumer Services,Advertising
J,Jacobs Engineering Group Inc.,$129.95 ,0.68,0.53%,16904696622,United States,,570770,Basic Industries,Military/Government/Technical
JACK,Jack In The Box Inc.,$113.67 ,3.89,3.54%,2594843983,United States,,410776,Consumer Services,Restaurants
JAGX,Jaguar Health Inc.,$1.98 ,0.18,10.00%,233275684,United States,2015,17274399,Health Care,Major Pharmaceuticals
JAKK,JAKKS Pacific Inc.,$7.59 ,0.46,6.45%,46128589,United States,1996,56735,Consumer Non-Durables,Recreational Products/Toys
JAMF,Jamf Holding Corp.,$36.93 ,1.61,4.56%,4337961880,United States,2020,264103,Technology,Computer Software: Prepackaged Software
JAN,JanOne Inc. (NV),$8.80 ,0.38,4.51%,21132408,United States,,2944778,Consumer Services,Home Furnishings
JAX,J. Alexander's Holdings Inc.,$9.92 ,0.28,2.91%,149693564,,2015,37430,Consumer Services,Restaurants
JAZZ,Jazz Pharmaceuticals plc (Ireland),$165.20 ,0.83,0.51%,9304962027,Ireland,2007,352945,Health Care,Major Pharmaceuticals
JBGS,JBG SMITH Properties Common Shares ,$32.45 ,0.66,2.08%,4266265005,United States,2017,821750,Consumer Services,Real Estate Investment Trusts
JBHT,J.B. Hunt Transport Services Inc.,$169.80 ,1.73,1.03%,17948710019,United States,,413865,Transportation,Trucking Freight/Courier Services
JBL,Jabil Inc.,$52.97 ,0.81,1.55%,7954822667,United States,1993,723862,Technology,Electrical Products
JBLU,JetBlue Airways Corporation,$20.37 ,0.03,0.15%,6449893368,United States,2002,4932404,Transportation,Air Freight/Delivery Services
JBSS,John B. Sanfilippo & Son Inc.,$90.42 ,0.05,0.06%,1036756895,United States,1991,44108,Consumer Non-Durables,Specialty Foods
JBT,John Bean Technologies Corporation,$135.90 ,2.56,1.92%,4312071122,United States,,150499,Technology,Industrial Machinery/Components
JCE,Nuveen Core Equity Alpha Fund Nuveen Core Equity Alpha Fund Common Shares of Beneficial Interest,$15.08 ,-0.13,-0.86%,241721557,United States,2007,83552,,
JCI,Johnson Controls International plc Ordinary Share,$59.90 ,0.23,0.39%,43030441349,Switzerland,,3049011,Consumer Services,Other Consumer Services
JCIC,Jack Creek Investment Corp. Class A Ordinary Shares,$9.70 ,0.02,0.21%,418312500,United States,2021,319219,Finance,Business Services
JCICU,Jack Creek Investment Corp. Units,$9.95 ,0.04,0.40%,0,United States,2021,90802,Finance,Business Services
JCICW,Jack Creek Investment Corp. Warrants,$0.58 ,0.0499,9.41%,0,United States,2021,128608,Finance,Business Services
JCO,Nuveen Credit Opportunities 2022 Target Term Fund Common Shares of Beneficial Interest,$8.41 ,0.02,0.24%,233381638,United States,2017,55481,,
JCOM,j2 Global Inc.,$121.03 ,1.17,0.98%,5464439265,United States,1999,292538,Technology,Telecommunications Equipment
JCS,Communications Systems Inc.,$6.08 ,0.12,2.01%,56711650,United States,,25355,Public Utilities,Telecommunications Equipment
JCTCF,Jewett-Cameron Trading Company Common Shares,$10.82 ,0.75,7.45%,37752722,United States,,1741,Consumer Services,RETAIL: Building Materials
JD,JD.com Inc. American Depositary Shares,$84.31 ,-0.02,-0.02%,1.30828E+11,China,2014,11896959,Consumer Services,Other Specialty Stores
JDD,Nuveen Diversified Dividend and Income Fund Shares of Beneficial Interest,$9.41 ,-0.07,-0.74%,185080745,United States,2003,91478,,
JEF,Jefferies Financial Group Inc.,$30.39 ,0.29,0.96%,7497304170,United States,,2728022,Finance,Investment Bankers/Brokers/Service
JELD,JELD-WEN Holding Inc.,$28.37 ,0.68,2.46%,2838017093,United States,2017,273579,Basic Industries,Forest Products
JEMD,Nuveen Emerging Markets Debt 2022 Target Term Fund Common Shares of Beneficial Interest $0.01 par value per share,$7.93 ,0.03,0.38%,112978647,,2017,13616,,
JEQ,Aberdeen Japan Equity Fund Inc. ,$9.10 ,0.08,0.89%,122017678,United States,1992,41386,,
JFIN,Jiayin Group Inc. American Depositary Shares,$8.47 ,0.22,2.67%,457591750,China,2019,1441637,Finance,Finance: Consumer Services
JFR,Nuveen Floating Rate Income Fund,$9.72 ,0.06,0.62%,553247509,United States,2004,834146,,
JFU,9F Inc. American Depositary Shares,$1.82 ,-0.03,-1.62%,355247620,China,2019,1110017,Finance,Finance: Consumer Services
JG,Aurora Mobile Limited American Depositary Shares,$4.30 ,0.07,1.66%,497609016,China,2018,984038,Technology,Computer Software: Programming Data Processing
JGH,Nuveen Global High Income Fund Common Shares of Beneficial Interest,$15.53 ,0.06,0.39%,359944913,United States,2014,57149,,
JHAA,Nuveen Corporate Income 2023 Target Term Fund,$9.89 ,-0.06,-0.60%,77393790,,2018,16049,,
JHB,Nuveen Corporate Income November 2021 Target Term Fund,$9.40 ,0.03,0.32%,525460461,,2016,101978,,
JHG,Janus Henderson Group plc Ordinary Shares,$32.11 ,0.96,3.08%,5534158147,,2017,989291,Finance,Investment Managers
JHI,John Hancock Investors Trust,$18.29 ,0.3,1.67%,159251487,United States,,25019,,
JHS,John Hancock Income Securities Trust,$15.56 ,-0.05,-0.32%,181220847,United States,,19674,,
JHX,James Hardie Industries plc American Depositary Shares (Ireland),$31.88 ,1.3,4.25%,14160059549,Ireland,,27164,Capital Goods,Building Materials
JIH,Juniper Industrial Holdings Inc. Class A,$12.84 ,0.44,3.55%,553725000,,2019,536855,Finance,Business Services
JILL,J. Jill Inc.,$9.95 ,0.2,2.05%,95834748,,2017,376718,Consumer Non-Durables,Apparel
JJSF,J & J Snack Foods Corp.,$156.64 ,-0.39,-0.25%,2972970340,United States,1986,77598,Consumer Non-Durables,Specialty Foods
JKHY,Jack Henry & Associates Inc.,$154.59 ,2.87,1.89%,11760785015,United States,1985,383329,Technology,EDP Services
JKS,JinkoSolar Holding Company Limited American Depositary Shares (each representing 4 Common Shares),$42.55 ,0.86,2.06%,1927253275,China,2010,2172556,Technology,Semiconductors
JLL,Jones Lang LaSalle Incorporated,$184.52 ,5.48,3.06%,9430959280,United States,,297708,Finance,Real Estate
JLS,Nuveen Mortgage and Income Fund,$20.73 ,-0.02,-0.10%,113754631,United States,2009,16395,,
JMIA,Jumia Technologies AG American Depositary Shares each representing two Ordinary Shares,$38.01 ,2.55,7.19%,3747504118,,2019,9837562,Consumer Services,Catalog/Specialty Distribution
JMM,Nuveen Multi-Market Income Fund (MA),$7.29 ,0.025,0.34%,68980539,United States,,3052,,
JMP,JMP Group LLC Common Shares,$6.08 ,0.1,1.67%,120525992,United States,2007,20958,Finance,Investment Bankers/Brokers/Service
JMPNL,JMP Group LLC 7.25% Senior Notes due 2027,$25.78 ,0.25,0.98%,0,United States,,874,Finance,Investment Bankers/Brokers/Service
JMPNZ,JMP Group LLC 6.875% Senior Notes due 2029,$24.73 ,0.0399,0.16%,0,United States,,5802,Finance,Investment Bankers/Brokers/Service
JNCE,Jounce Therapeutics Inc.,$10.50 ,0.23,2.24%,537007391,United States,2017,253601,Health Care,Biotechnology: Biological Products (No Diagnostic Substances)
JNJ,Johnson & Johnson,$162.83 ,-1.52,-0.93%,4.28684E+11,United States,,7226608,Health Care,Major Pharmaceuticals
JNPR,Juniper Networks Inc.,$25.62 ,0.29,1.15%,8407769176,United States,1999,3153015,Technology,Computer Communications Equipment
JOAN,JOANN Inc.,$10.54 ,0.39,3.84%,425511710,United States,2021,672607,Consumer Services,Other Specialty Stores
JOB,GEE Group Inc.,$1.38 ,0.11,8.66%,24380630,United States,,778132,Technology,Diversified Commercial Services
JOBS,51job Inc. American Depositary Shares,$62.85 ,0.25,0.40%,4236508392,China,2004,115112,Technology,Diversified Commercial Services
JOE,St. Joe Company (The),$44.09 ,1.19,2.77%,2596131585,United States,,213601,Consumer Services,Homebuilding
JOF,Japan Smaller Capitalization Fund Inc,$9.34 ,0.04,0.43%,264638561,United States,1990,27223,,
JOFF,JOFF Fintech Acquisition Corp. Class A,$9.82 ,0.04,0.41%,0,United States,2021,9411,Finance,Business Services
JOFFU,JOFF Fintech Acquisition Corp. Unit,$9.97 ,0.02,0.20%,0,United States,2021,52512,Finance,Business Services
JOFFW,JOFF Fintech Acquisition Corp. Warrant,$0.80 ,-0.03,-3.61%,0,United States,2021,47914,Finance,Business Services
JOUT,Johnson Outdoors Inc. Class A,$146.04 ,3.29,2.31%,1476781599,United States,,48103,Consumer Non-Durables,Recreational Products/Toys
JP,Jupai Holdings Limited American Depositary Shares each representing six ordinary shares,$2.24 ,0.02,0.90%,75520070,,2015,30926,Consumer Services,Other Consumer Services
JPC,Nuveen Preferred & Income Opportunities Fund,$9.49 ,0,0.00%,980840364,United States,2003,357173,,
JPI,Nuveen Preferred and Income Term Fund Common Shares of Beneficial Interest,$25.11 ,0.1,0.40%,571538528,,2012,48312,,
JPM,JP Morgan Chase & Co.,$153.71 ,1.48,0.97%,4.69047E+11,United States,,16556048,Finance,Major Banks
JPS,Nuveen Preferred & Income Securities Fund,$9.70 ,-0.02,-0.21%,1976764426,United States,2002,543374,,
JPT,Nuveen Preferred and Income 2022 Term Fund Common Shares of Beneficial Interest,$24.36 ,-0.1287,-0.53%,166657407,United States,2017,7380,,
JQC,Nuveen Credit Strategies Income Fund Shares of Beneficial Interest,$6.55 ,0.05,0.77%,888240850,United States,2003,692754,,
JRI,Nuveen Real Asset Income and Growth Fund Common Shares of Beneficial Interest,$15.07 ,0.35,2.38%,413726958,United States,2012,282170,,
JRJC,China Finance Online Co. Limited American Depositary Shares,$12.50 ,-0.28,-2.19%,30524500,China,2004,32004,Finance,Investment Bankers/Brokers/Service
JRO,Nuveen Floating Rate Income Opportuntiy Fund Shares of Beneficial Interest,$9.58 ,0.04,0.42%,388384868,United States,2004,208128,,
JRS,Nuveen Real Estate Income Fund Common Shares of Beneficial Interest,$9.62 ,0.03,0.31%,277945571,United States,2001,124234,,
JRSH,Jerash Holdings (US) Inc.,$6.80 ,0.5001,7.94%,77010000,United States,2018,88823,Consumer Non-Durables,Apparel
JRVR,James River Group Holdings Ltd. Common Shares,$46.40 ,0.78,1.71%,1427519664,Bermuda,2014,180775,Finance,Property-Casualty Insurers
JSD,Nuveen Short Duration Credit Opportunities Fund Common Shares of Beneficial Interest,$14.16 ,0.04,0.28%,142812776,United States,2011,37097,,
JSM,Navient Corporation 6% Senior Notes due December 15 2043,$24.45 ,-0.12,-0.49%,0,United States,,31002,Finance,Finance: Consumer Services
JT,Jianpu Technology Inc. American depositary shares,$2.58 ,-0.02,-0.77%,54526200,,2017,105392,Technology,Computer Software: Programming Data Processing
JTA,Nuveen Tax-Advantaged Total Return Strategy Fund Common Share of Beneficial Interest,$10.72 ,-0.02,-0.19%,148481616,United States,2004,99227,,
JTD,Nuveen Tax-Advantaged Dividend Growth Fund Common Shares of Beneficial Interest,$15.08 ,-0.03,-0.20%,218423847,United States,,68355,,
JUPW,Jupiter Wellness Inc.,$4.75 ,0.01,0.21%,43616082,United States,2020,50701,Consumer Non-Durables,Package Goods/Cosmetics
JUPWW,Jupiter Wellness Inc. Warrant,$2.02 ,-0.0799,-3.81%,0,United States,2020,10850,Consumer Non-Durables,Package Goods/Cosmetics
JVA,Coffee Holding Co. Inc.,$4.97 ,0.03,0.61%,28371737,United States,2005,18071,Consumer Non-Durables,Packaged Foods
JWEL,Jowell Global Ltd. Ordinary Shares,$7.79 ,0.0535,0.69%,193688309,China,2021,74020,Consumer Services,Other Consumer Services
JWN,Nordstrom Inc.,$36.76 ,-1.11,-2.93%,5799639169,United States,,3755690,Consumer Services,Clothing/Shoe/Accessory Stores
JWS,Jaws Acquisition Corp. Class A Ordinary Shares,$13.42 ,0.17,1.28%,1157475000,,2020,352191,Health Care,Medical/Nursing Services
JWSM,Jaws Mustang Acquisition Corp. Class A Ordinary Shares,$9.90 ,0.02,0.20%,0,,2021,28806,Finance,Business Services
JYAC,Jiya Acquisition Corp. Class A,$9.87 ,0.025,0.25%,135417250,United States,2020,7686,Finance,Business Services
JYNT,The Joint Corp.,$45.58 ,-2.79,-5.77%,644496232,United States,2014,134165,Miscellaneous,Multi-Sector Companies
K,Kellogg Company,$63.34 ,0.04,0.06%,21558111036,United States,,3652905,Consumer Non-Durables,Packaged Foods
KAI,Kadant Inc,$186.94 ,1.93,1.04%,2157706346,United States,,30743,Technology,Industrial Machinery/Components
KAIIU,Kismet Acquisition Two Corp. Unit,$9.94 ,0,0.00%,0,United States,2021,17247,Finance,Business Services
KAIR,Kairos Acquisition Corp. Class A Ordinary Shares,$9.73 ,-0.02,-0.21%,0,United States,2021,4825,Finance,Business Services
KAIRU,Kairos Acquisition Corp. Unit,$10.05 ,0.04,0.40%,0,United States,2021,11708,Finance,Business Services
KAIRW,Kairos Acquisition Corp. Warrant,$0.54 ,-0.05,-8.48%,0,United States,2021,2509,Finance,Business Services
KALA,Kala Pharmaceuticals Inc.,$7.11 ,0.37,5.49%,398585640,United States,2017,1377738,Health Care,Major Pharmaceuticals
KALU,Kaiser Aluminum Corporation,$111.13 ,0.63,0.57%,1757206341,United States,,91728,Capital Goods,Metal Fabrications
KALV,KalVista Pharmaceuticals Inc.,$27.46 ,1.77,6.89%,667502925,United Kingdom,2015,282546,Health Care,Major Pharmaceuticals
KAMN,Kaman Corporation,$51.71 ,0.42,0.82%,1433977973,United States,,114597,Capital Goods,Military/Government/Technical
KAR,KAR Auction Services Inc,$15.26 ,0.26,1.73%,1979252581,United States,2009,1556715,Consumer Durables,Automotive Aftermarket
KARO,Karooooo Ltd. Ordinary Shares,$33.99 ,5.99,21.39%,0,Singapore,,754785,,
KB,KB Financial Group Inc,$48.33 ,-1.1,-2.23%,19072677411,South Korea,,285631,Finance,Commercial Banks
KBAL,Kimball International Inc. Class B,$13.95 ,-0.05,-0.36%,514502672,United States,,180557,Consumer Durables,Home Furnishings
KBH,KB Home,$47.78 ,1.25,2.69%,4723087641,United States,1986,1034661,Capital Goods,Homebuilding
KBNT,Kubient Inc.,$7.53 ,0.23,3.15%,88674402,United States,2020,543748,Technology,EDP Services
KBNTW,Kubient Inc. Warrant,$3.01 ,-0.0067,-0.22%,0,United States,2020,7645,Technology,EDP Services
KBR,KBR Inc.,$37.18 ,-1.21,-3.15%,5236571146,United States,2006,1947181,Basic Industries,Military/Government/Technical
KBSF,KBS Fashion Group Limited,$3.59 ,0.3,9.12%,9302763,China,2013,209935,Consumer Non-Durables,Apparel
KC,Kingsoft Cloud Holdings Limited American Depositary Shares,$43.94 ,4.62,11.75%,9782856173,China,2020,2988951,Technology,Computer Software: Prepackaged Software
KCAPL,KCAP Financial Inc. 6.125% Notes due 2022,$25.33 ,0.0786,0.31%,0,United States,,1779,,
KDMN,Kadmon Holdings Inc.,$3.95 ,0.06,1.54%,678676933,United States,,4046462,Health Care,Major Pharmaceuticals
KDNY,Chinook Therapeutics Inc.,$15.50 ,-0.04,-0.26%,653455696,United States,2015,73160,Health Care,Major Pharmaceuticals
KDP,Keurig Dr Pepper Inc.,$34.50 ,0.13,0.38%,48550720884,United States,,6344524,Consumer Non-Durables,Beverages (Production/Distribution)
KE,Kimball Electronics Inc.,$25.92 ,0.12,0.47%,646887021,United States,,69988,Technology,Electrical Products
KELYA,Kelly Services Inc. Class A,$23.84 ,1.57,7.05%,936950168,United States,,266760,Technology,Professional Services
KELYB,Kelly Services Inc. Class B,$30.49 ,8.17,36.60%,1198305814,United States,,591436,Technology,Professional Services
KEN,Kenon Holdings Ltd. Ordinary Shares,$31.25 ,0.75,2.46%,1683473719,Singapore,2015,9121,Public Utilities,Electric Utilities: Central
KEP,Korea Electric Power Corporation,$10.40 ,0.14,1.37%,13352852802,South Korea,1994,101336,Public Utilities,Electric Utilities: Central
KEQU,Kewaunee Scientific Corporation,$12.34 ,0,0.00%,34092915,United States,,153,Capital Goods,Medical Specialities
KERN,Akerna Corp.,$5.11 ,0.17,3.44%,71839993,United States,2018,460056,Technology,EDP Services
KERNW,Akerna Corp Warrant,$1.30 ,-0.05,-3.70%,0,United States,2018,12000,Technology,EDP Services
KEX,Kirby Corporation,$60.23 ,-0.05,-0.08%,3618983635,United States,,443355,Consumer Services,Marine Transportation
KEY,KeyCorp,$20.27 ,0.29,1.45%,19460386038,United States,,9114016,Finance,Major Banks
KEYS,Keysight Technologies Inc.,$143.79 ,0.39,0.27%,26744139377,United States,2014,1024814,Capital Goods,Industrial Machinery/Components
KF,Korea Fund Inc. (The) New,$43.90 ,0.51,1.18%,220376946,United States,,14947,,
KFFB,Kentucky First Federal Bancorp,$6.77 ,0.02,0.30%,55813336,United States,,653,Finance,Savings Institutions
KFRC,Kforce Inc.,$54.29 ,0.69,1.29%,1199104804,United States,1995,77630,Technology,Professional Services
KFS,Kingsway Financial Services Inc. (DE),$4.60 ,-0.05,-1.08%,104470917,Canada,,13610,Finance,Property-Casualty Insurers
KFY,Korn Ferry,$63.21 ,0.84,1.35%,3413767868,United States,1999,200705,Technology,Diversified Commercial Services
KGC,Kinross Gold Corporation,$7.02 ,0.35,5.25%,8833968000,Canada,,18861288,Basic Industries,Precious Metals
KHC,The Kraft Heinz Company,$40.03 ,0.03,0.08%,48961352094,United States,,4560998,Consumer Non-Durables,Packaged Foods
KIDS,OrthoPediatrics Corp.,$50.36 ,1.61,3.30%,989993751,United States,2017,203358,Health Care,Medical/Dental Instruments
KIIIU,Kismet Acquisition Three Corp. Unit,$10.00 ,0.12,1.22%,0,United States,2021,49595,Finance,Business Services
KIM,Kimco Realty Corporation,$19.20 ,0.45,2.40%,8322071462,United States,,3963021,Consumer Services,Real Estate Investment Trusts
KIN,Kindred Biosciences Inc.,$5.00 ,0.03,0.60%,207246090,United States,2013,364785,Health Care,Major Pharmaceuticals
KINS,Kingstone Companies Inc.,$8.14 ,-0.4,-4.68%,86896112,United States,,11946,Finance,Property-Casualty Insurers
KINZ,KINS Technology Group Inc. Class A,$9.88 ,0.07,0.71%,340860000,United States,2021,9064,Finance,Business Services
KINZU,KINS Technology Group Inc. Unit,$10.15 ,0.04,0.40%,0,United States,2020,3349,Finance,Business Services
KINZW,KINS Technology Group Inc. Warrant,$0.73 ,0.074,11.33%,0,United States,2021,21277,Finance,Business Services
KIO,KKR Income Opportunities Fund Common Shares,$15.82 ,0,0.00%,321783783,,2013,83410,,
KIQ,Kelso Technologies Inc Ordinary Shares,$1.08 ,-0.09,-7.69%,58503693,Canada,,8383175,Capital Goods,Railroads
KIRK,Kirkland's Inc. COMMONSTOCK,$28.02 ,-0.08,-0.29%,400553101,United States,2002,515374,Consumer Services,Other Specialty Stores
KKR,KKR & Co. Inc.,$50.35 ,1.5,3.07%,29032372611,United States,,2397407,Finance,Investment Managers
KL,Kirkland Lake Gold Ltd. Common Shares,$35.41 ,1.61,4.76%,9455311944,,,2103509,Basic Industries,Precious Metals
KLAC,KLA Corporation,$347.29 ,16.89,5.11%,53508585546,United States,1980,1885715,Capital Goods,Electronic Components
KLAQ,KL Acquisition Corp Class A,$9.76 ,0.06,0.62%,350750000,United States,2021,7163,Finance,Business Services
KLAQU,KL Acquisition Corp Unit,$9.98 ,0.07,0.71%,0,United States,2021,12156,Finance,Business Services
KLAQW,KL Acquisition Corp Warrant,$0.67 ,0.02,3.08%,0,United States,2021,2863,Finance,Business Services
KLDO,Kaleido Biosciences Inc.,$8.70 ,0.6,7.41%,369461082,United States,2019,193156,Health Care,Biotechnology: Biological Products (No Diagnostic Substances)
KLIC,Kulicke and Soffa Industries Inc.,$51.39 ,2.28,4.64%,3190136362,Singapore,,1071033,Technology,Semiconductors
KLR,Kaleyra Inc.,$15.10 ,1,7.09%,457359174,United States,2018,211535,Technology,EDP Services
KLXE,KLX Energy Services Holdings Inc.,$17.27 ,1.24,7.74%,146969738,United States,,49229,Energy,Oilfield Services/Equipment
KMB,Kimberly-Clark Corporation,$136.98 ,-2.07,-1.49%,46300159821,United States,,3235274,Consumer Durables,Containers/Packaging
KMDA,Kamada Ltd. Ordinary Shares,$6.19 ,0,0.00%,276973803,Israel,2013,83387,Health Care,Major Pharmaceuticals
KMF,Kayne Anderson NextGen Energy & Infrastructure Inc.,$6.75 ,0.09,1.35%,318582869,,2010,153551,,
KMI,Kinder Morgan Inc.,$16.84 ,0.19,1.14%,38133341705,United States,2011,13315997,Public Utilities,Natural Gas Distribution
KMPH,KemPharm Inc.,$9.50 ,0.3,3.26%,269575050,United States,,781453,Health Care,Major Pharmaceuticals
KMPR,Kemper Corporation,$81.14 ,1.42,1.78%,5322353796,United States,,273229,Finance,Property-Casualty Insurers
KMT,Kennametal Inc.,$40.63 ,0.66,1.65%,3393945912,United States,,434305,Capital Goods,Industrial Machinery/Components
KMX,CarMax Inc,$123.31 ,-9.35,-7.05%,20042986323,United States,,4634494,Consumer Durables,Automotive Aftermarket
KN,Knowles Corporation,$21.44 ,0.52,2.49%,1987346003,,2014,306172,Consumer Non-Durables,Consumer Electronics/Appliances
KNDI,Kandi Technologies Group Inc,$6.49 ,0.24,3.84%,469730332,China,,1916393,Capital Goods,Auto Manufacturing
KNL,Knoll Inc.,$16.56 ,0.05,0.30%,841353603,United States,2004,279776,Consumer Durables,Office Equipment/Supplies/Services
KNOP,KNOT Offshore Partners LP Common Units representing Limited Partner Interests,$18.15 ,0.34,1.91%,593397806,United Kingdom,2013,79129,Consumer Services,Marine Transportation
KNSA,Kiniksa Pharmaceuticals Ltd. Class A,$18.48 ,-0.03,-0.16%,1260932978,United States,2018,561661,Health Care,Major Pharmaceuticals
KNSL,Kinsale Capital Group Inc.,$167.64 ,2.84,1.72%,3817688184,United States,2016,132459,Finance,Property-Casualty Insurers
KNTE,Kinnate Biopharma Inc.,$31.12 ,-0.04,-0.13%,1348343055,United States,2020,152478,Health Care,Major Pharmaceuticals
KNX,Knight-Swift Transportation Holdings Inc.,$48.76 ,0.67,1.39%,8077058551,United States,2017,1504146,Transportation,Trucking Freight/Courier Services
KO,Coca-Cola Company (The),$52.51 ,-0.2,-0.38%,2.26282E+11,United States,,15831581,Consumer Non-Durables,Beverages (Production/Distribution)
KOD,Kodiak Sciences Inc,$109.10 ,-4.29,-3.78%,5581820458,United States,2018,399583,Health Care,Biotechnology: Biological Products (No Diagnostic Substances)
KODK,Eastman Kodak Company Common New,$8.29 ,0.42,5.34%,650793816,United States,,4888995,Miscellaneous,Industrial Machinery/Components
KOF,Coca Cola Femsa S.A.B. de C.V.  American Depositary Shares each representing 10 Units (each Unit consists of 3 Series B Shares and 5 Series L Shares),$46.60 ,0.4,0.87%,9789902750,Mexico,1993,107729,Consumer Non-Durables,Beverages (Production/Distribution)
KOP,Koppers Holdings Inc. Koppers Holdings Inc.,$34.63 ,-0.13,-0.37%,730642579,United States,2006,120817,Basic Industries,Forest Products
KOPN,Kopin Corporation,$10.40 ,-0.09,-0.86%,946245758,United States,1992,4164389,Technology,Semiconductors
KOR,Corvus Gold Inc. Common Shares,$1.89 ,0.1,5.59%,239336077,Canada,,147441,Basic Industries,Precious Metals
KOS,Kosmos Energy Ltd. Common Shares (DE),$3.25 ,0.18,5.86%,1325491450,Bermuda,2011,6855483,Energy,Oil & Gas Production
KOSS,Koss Corporation,$23.20 ,0.71,3.16%,197590294,United States,,4707225,Consumer Non-Durables,Consumer Electronics/Appliances
KPTI,Karyopharm Therapeutics Inc.,$10.84 ,0.32,3.04%,809035714,United States,2013,1378368,Health Care,Major Pharmaceuticals
KR,Kroger Company (The),$35.95 ,-0.04,-0.11%,27214150000,United States,,11932293,Consumer Services,Food Chains
KRA,Kraton Corporation,$37.31 ,0.72,1.97%,1189965998,United States,2009,262421,Basic Industries,Major Chemicals
KRBP,Kiromic BioPharma Inc.,$9.31 ,-0.1,-1.06%,68270221,United States,2020,3004,Health Care,Biotechnology: Biological Products (No Diagnostic Substances)
KRC,Kilroy Realty Corporation,$67.28 ,1.65,2.51%,7829312779,United States,1997,741357,Consumer Services,Real Estate Investment Trusts
KREF,KKR Real Estate Finance Trust Inc.,$18.70 ,0.31,1.69%,1040083304,United States,2017,240958,Consumer Services,Real Estate Investment Trusts
KRG,Kite Realty Group Trust,$19.79 ,0.5,2.59%,1668144023,United States,2004,627292,Consumer Services,Real Estate Investment Trusts
KRKR,36Kr Holdings Inc. American Depositary Shares,$3.37 ,0.02,0.60%,126355926,China,2019,73206,Miscellaneous,Business Services
KRMD,Repro Med Systems Inc.,$3.58 ,0.06,1.71%,159222501,United States,,168156,Health Care,Medical/Dental Instruments
KRNL,Kernel Group Holdings Inc. Class A Ordinary Shares,$9.65 ,9.65,,0,United States,2021,150041,Finance,Business Services
KRNLU,Kernel Group Holdings Inc. Units,$10.00 ,0.02,0.20%,0,United States,2021,122418,Finance,Business Services
KRNLW,Kernel Group Holdings Inc. Warrants,$0.85 ,0,0.00%,0,United States,2021,100,Finance,Business Services
KRNT,Kornit Digital Ltd. Ordinary Shares,$100.21 ,1.09,1.10%,4618546122,Israel,2015,355515,Capital Goods,Industrial Machinery/Components
KRNY,Kearny Financial Corp,$12.27 ,0.19,1.57%,1033137202,United States,,239969,Finance,Savings Institutions
KRO,Kronos Worldwide Inc,$15.44 ,0.14,0.92%,1783979550,United States,,115883,Basic Industries,Major Chemicals
KRON,Kronos Bio Inc.,$28.51 ,-0.76,-2.60%,1597919442,United States,2020,152378,Health Care,Major Pharmaceuticals
KROS,Keros Therapeutics Inc.,$58.76 ,-2.79,-4.53%,1367387331,United States,2020,178835,Health Care,Major Pharmaceuticals
KRP,Kimbell Royalty Partners Common Units Representing Limited Partner Interests,$10.20 ,0.06,0.59%,612838012,United States,2017,84592,Energy,Oil & Gas Production
